{"schema": "implement-rfc.milestone-assignment.v1", "run_id": "personal-mode-20260913", "dispatch_id": "pm-001", "producer_id": "/root/personal_mode_integrator", "mandate_revision": "1", "milestone": "personal-binding", "consumer_root": "/Users/EXAMPLE/Documents/GitHub/AgentSkills", "branch": "main", "binding": {"plan_id": "personal-implement-rfc", "plan_path": "docs/rfcs/plans/personal-implement-rfc/milestone-plan.json", "milestone_id": "personal-binding", "definition_fingerprint": "sha256:04d81f2e64ac8b0e858a4186253e49864ec0daea6b2e76755576961c8fceaae9", "obligations": [{"id": "ASK-0075:*", "source": "ASK-0075", "selector": null, "source_fingerprint": "sha256:d625c1de495d7526e7b42cb42ebee0f6435db6cbef069214366fbccbf43ef14f"}], "obligation_fingerprint": "sha256:1f17eb1fd78886d3a84ab9a6eae199445d5887022c955c2d37cc406bb39d3e56", "exit_criteria": [{"id": "personal-binding:exit:1", "text": "Public setup and status paths bind the same Git common repository across worktrees, preserve explicit mode precedence, and refuse absent or unsafe bindings."}, {"id": "personal-binding:exit:2", "text": "Disposable source repositories show zero workflow-generated source and Git-directory changes after setup and observation; supplied and managed tracker cases pass."}, {"id": "personal-binding:exit:3", "text": "Existing project-mode context and two linked consumer paths still resolve their original project facts."}], "prerequisite_fingerprint": "sha256:44136fa355b3678a1146ad16f7e8649e94fb4fc21fe77e8310c060f61caaff8a", "structural": "valid", "references": "resolved", "semantic_coverage": "unknown", "diagnostics": [], "diagnostics_truncated": false}, "target_milestones": ["personal-binding", "private-workflow-lifecycle", "personal-host-integration", "qualification-and-closeout"]}
