{"schema": "implement-rfc.milestone-assignment.v1", "run_id": "personal-mode-20260913", "dispatch_id": "pm-004", "producer_id": "/root/personal_qualification_integrator", "mandate_revision": "1", "milestone": "qualification-and-closeout", "consumer_root": "/Users/EXAMPLE/Documents/GitHub/AgentSkills", "branch": "main", "binding": {"plan_id": "personal-implement-rfc", "plan_path": "docs/rfcs/plans/personal-implement-rfc/milestone-plan.json", "milestone_id": "qualification-and-closeout", "definition_fingerprint": "sha256:13a20de384a595c49bf784040ca4168ee474dc34014c9f826c1113085d4ed375", "obligations": [{"id": "ASK-0081:*", "source": "ASK-0081", "selector": null, "source_fingerprint": "sha256:66670ec69774b4990a80c245a4ced2096818c702320ae7305722559b48a860ce"}, {"id": "ASK-0082:*", "source": "ASK-0082", "selector": null, "source_fingerprint": "sha256:2a121285cda787d3c9d81cb1b681347419979fb3f4411c8d0f959af2db830432"}], "obligation_fingerprint": "sha256:c6adeb02f8f4f9bbcde8c14160447a2b788fb7bc855a099f5adf05ad2a0177ab", "exit_criteria": [{"id": "qualification-and-closeout:exit:1", "text": "Complete private run, footprint, paired lanes, recovery, synchronization and behavior parity satisfy the original mandate with direct evidence."}, {"id": "qualification-and-closeout:exit:2", "text": "Actual Codex and Claude Code personal-role loading and bounded source/external-state operation are evidenced, or required criteria remain explicitly pending."}, {"id": "qualification-and-closeout:exit:3", "text": "Every RFC criterion has actual revision/evidence on the closeout, selected adoption is ownership-safe, and no unrelated consumer or private product metadata is changed."}], "prerequisite_fingerprint": "sha256:2b3158b51ee07705d7e46ddd76a3706af7cf198bd68ed3a2f5e7b5d34cb7b205", "structural": "valid", "references": "resolved", "semantic_coverage": "unknown", "diagnostics": [], "diagnostics_truncated": false}, "target_milestones": ["personal-binding", "private-workflow-lifecycle", "personal-host-integration", "qualification-and-closeout"]}
