{"schema": "implement-rfc.milestone-assignment.v1", "run_id": "personal-mode-20260913", "dispatch_id": "pm-002", "producer_id": "/root/private_lifecycle_integrator", "mandate_revision": "1", "milestone": "private-workflow-lifecycle", "consumer_root": "/Users/EXAMPLE/Documents/GitHub/AgentSkills", "branch": "main", "binding": {"plan_id": "personal-implement-rfc", "plan_path": "docs/rfcs/plans/personal-implement-rfc/milestone-plan.json", "milestone_id": "private-workflow-lifecycle", "definition_fingerprint": "sha256:f26037a6a9c783dab1baa900f23b3d5721fa6e2046d299f9911c725fd74c2f81", "obligations": [{"id": "ASK-0076:*", "source": "ASK-0076", "selector": null, "source_fingerprint": "sha256:3d934db1e6d6309c17462e01f694994dc61dff9fa070f4a448b27aa4543d7595"}, {"id": "ASK-0077:*", "source": "ASK-0077", "selector": null, "source_fingerprint": "sha256:c4ff8815f3a0880c0c370830fd7ddd69ddbbed73f6ef77f9484a8d18392b51d9"}, {"id": "ASK-0078:*", "source": "ASK-0078", "selector": null, "source_fingerprint": "sha256:874fbbe7fb6c6e4ae48fb3ec7d25b81588fdfc1588ca1cdc54cbdb612c30abfa"}], "obligation_fingerprint": "sha256:030667d3446fa26649d38471a75894a17dbb2c24cfe5c7c107ec4d60c97b89d1", "exit_criteria": [{"id": "private-workflow-lifecycle:exit:1", "text": "Plan intake, claim, verify, source commit, interrupt, resume and closeout use the shared public helpers with portable tracker records and local runtime receipts."}, {"id": "private-workflow-lifecycle:exit:2", "text": "Paired lanes, reservations, source/tracker revision handoff, source-message and publication privacy, and pre/post commit failure recovery pass direct disposable tests."}, {"id": "private-workflow-lifecycle:exit:3", "text": "Project-mode planning, board, partial acceptance, stale return, human-pending and closeout regressions remain passing."}], "prerequisite_fingerprint": "sha256:6572c1149cbc3a36321fc99f1e1450b0dfd4ff0bd8fef82d81034bf5a1d310d4", "structural": "valid", "references": "resolved", "semantic_coverage": "unknown", "diagnostics": [], "diagnostics_truncated": false}, "target_milestones": ["personal-binding", "private-workflow-lifecycle", "personal-host-integration", "qualification-and-closeout"]}
